{
    "$schema": "http://json-schema.org/draft-07/schema#",
    "title": "Missing Translations Translated",
    "description": "Schema for the missing translations translated JSON file",
    "type": "array",
    "items": {
        "type": "object",
        "required": [
            "file",
            "key",
            "original",
            "translation"
        ],
        "properties": {
            "file": {
                "type": "string",
                "description": "The relative path to the localization file"
            },
            "key": {
                "type": "string",
                "description": "The localization key"
            },
            "original": {
                "type": "string",
                "description": "The original text in the source language"
            },
            "translation": {
                "type": "string",
                "description": "The translated text in the target language"
            }
        }
    }
}